{
  "schema_version": "v1",
  "project": "contiki-ng",
  "cve": "CVE-2021-21281",
  "attack_scenarios": [
    {
      "id": "AS-001",
      "title": "Remote out-of-bounds read via crafted TCP data offset (information leak)",
      "exploit_chain": {
        "steps": [
          {
            "order": 1,
            "evidence_ir": "IR-001",
            "action": "Attacker, on the same IPv6 network, sends a TCP segment to a port the Contiki-NG node accepts. The segment carries a small actual payload but a tcpoffset whose high nibble is 0xF (advertising a 60-byte TCP header).",
            "result": "Packet flows tcpip_input -> packet_input -> uip_process. IP-layer length checks (uip6.c:1120, 1143) and TCP checksum (uip6.c:1613) all pass since the attacker can satisfy them."
          },
          {
            "order": 2,
            "evidence_ir": "IR-001",
            "action": "uip_process reads c = (UIP_TCP_BUF->tcpoffset >> 4) << 2 at uip6.c:1842 -> c = 60.",
            "result": "Local variable c holds attacker-controlled value 60 with no bounds check."
          },
          {
            "order": 3,
            "evidence_ir": "IR-001",
            "action": "uip_process executes uip_len = uip_len - c - UIP_IPH_LEN at uip6.c:1846 with uip_len smaller than c + UIP_IPH_LEN.",
            "result": "uint16_t arithmetic underflow: uip_len wraps to a very large value (close to 0xFFFF). Subsequent code treats uip_buf as containing that many bytes of TCP payload."
          },
          {
            "order": 4,
            "evidence_ir": "IR-001",
            "action": "Downstream TCP processing (sequence number checks, ACK handling, application delivery via UIP_APPCALL) reads from uip_buf at offsets up to the inflated uip_len.",
            "result": "Out-of-bounds reads of memory adjacent to uip_buf. Depending on what neighbors uip_buf in BSS/heap, the application may receive disclosed bytes (info leak) or experience corrupted state."
          }
        ]
      },
      "sink": {
        "function": "uip_process",
        "file": "os/net/ipv6/uip6.c",
        "line": 1846,
        "evidence_ir_id": "IR-001",
        "sink_type": "state_corruption"
      },
      "impact": {
        "category": "data_leak",
        "description": "The proximate sink at uip6.c:1846 is state_corruption: the underflow turns uip_len into a wraparound value (~0xFFFE) without performing any memory access at that line. The harmful out-of-bounds memory read is downstream consumption of the corrupted uip_len: subsequent TCP processing (sequence number checks, ACK handling, application delivery via UIP_APPCALL) reads from uip_buf at offsets up to the inflated uip_len. The advisory and fix commit message characterize the end-to-end effect as 'OOB access'; primary realistic impact on a uIP node is information disclosure of stack/BSS bytes via TCP delivery or via the application receiving more bytes than were actually on the wire."
      },
      "verdict": {
        "exploitability": "medium",
        "reason": "Trigger is a single crafted TCP segment from any host that can reach the target IPv6 address. No authentication required for the parse. Main constraint is reaching the 'found' label, which requires either an open listener or matching an existing flow."
      },
      "confidence": "high",
      "uncertainty": "Whether the leaked bytes are stably useful to a remote attacker depends on the layout around uip_buf, which is platform/build-specific."
    },
    {
      "id": "AS-002",
      "title": "Same OOB read via 6LoWPAN inbound path (mesh / 802.15.4 networks)",
      "exploit_chain": {
        "steps": [
          {
            "order": 1,
            "evidence_ir": "IR-002",
            "action": "Attacker on the 802.15.4 mesh sends a fragmented 6LoWPAN datagram that reassembles into a valid IPv6 TCP segment with the same crafted tcpoffset as AS-001.",
            "result": "sicslowpan reassembly succeeds; the static input() handler at sicslowpan.c:1802 invokes tcpip_input() at sicslowpan.c:2056."
          },
          {
            "order": 2,
            "evidence_ir": "IR-002",
            "action": "Reassembled datagram drives the same path through uip_process culminating in the underflow at uip6.c:1846.",
            "result": "Same OOB read as AS-001."
          }
        ]
      },
      "sink": {
        "function": "uip_process",
        "file": "os/net/ipv6/uip6.c",
        "line": 1846,
        "evidence_ir_id": "IR-002",
        "sink_type": "state_corruption"
      },
      "impact": {
        "category": "data_leak",
        "description": "Same primitive as AS-001 reached over 6LoWPAN — sink_type=state_corruption at uip6.c:1846 (uip_len wraparound), with the OOB read manifesting downstream when the corrupted uip_len is consumed by TCP sequence / ACK / application-delivery code. Relevant to deployed Contiki-NG IoT nodes whose primary attack surface is the mesh."
      },
      "verdict": {
        "exploitability": "medium",
        "reason": "Requires attacker on the same 802.15.4 mesh (one hop or via routing); otherwise identical to AS-001."
      },
      "confidence": "high",
      "uncertainty": "Exact reachability per deployment depends on whether the node has an open TCP listener or established flow on the mesh."
    }
  ]
}
