{
  "schema_version": "v1",
  "project": "libssh",
  "cve": "CVE-2018-10933",
  "attack_scenarios": [
    {
      "id": "AS-001",
      "title": "Server-side Authentication Bypass via Premature SSH2_MSG_USERAUTH_SUCCESS",
      "exploit_chain": {
        "steps": [
          {
            "order": 1,
            "evidence_ir": "IR-001",
            "action": "Attacker connects to the libssh-based server, triggering session initialization.",
            "result": "The session is marked as a server session (session->server = 1) and enters the protocol state machine."
          },
          {
            "order": 2,
            "evidence_ir": "IR-028",
            "action": "Attacker sends a crafted SSH2_MSG_USERAUTH_SUCCESS (type 52) packet during the Key Exchange (KEX) or Diffie-Hellman (DH) phase.",
            "result": "The packet dispatcher (ssh_packet_process) invokes the handler for type 52 without verifying if the current session state allows authentication success."
          },
          {
            "order": 3,
            "evidence_ir": "IR-026",
            "action": "The handler ssh_packet_userauth_success is executed.",
            "result": "The session state is forced to SSH_SESSION_STATE_AUTHENTICATED and the SSH_SESSION_FLAG_AUTHENTICATED bit is set in session->flags."
          },
          {
            "order": 4,
            "evidence_ir": "IR-039",
            "action": "The server state machine continues processing the connection callback.",
            "result": "The logic at src/server.c:524 sees the AUTHENTICATED flag and confirms the transition to the authenticated state, bypassing all credential checks."
          }
        ]
      },
      "sink": {
        "function": "ssh_packet_userauth_success",
        "file": "src/auth.c",
        "line": 282,
        "evidence_ir_id": "IR-026",
        "sink_type": "auth_bypass"
      },
      "impact": {
        "category": "privilege_bypass",
        "description": "An unauthenticated attacker can gain full access to the server's shell or resources by simply telling the server that authentication succeeded, bypassing passwords and keys."
      },
      "verdict": {
        "exploitability": "high",
        "reason": "The vulnerability is a logical flaw in the state machine that requires no complex memory corruption or timing; it only requires sending a standard SSH packet at an unexpected time."
      },
      "confidence": "high",
      "uncertainty": "The chain is well-supported by the IRs. IR-039 explicitly shows the state transition based on the flag that IR-026 sets."
    },
    {
      "id": "AS-002",
      "title": "Client-side State Corruption via Premature Server Success Message",
      "exploit_chain": {
        "steps": [
          {
            "order": 1,
            "evidence_ir": "IR-010",
            "action": "A malicious server sends a banner and then immediately follows with a SSH2_MSG_USERAUTH_SUCCESS packet before the client has even started authentication.",
            "result": "The client's packet dispatcher processes the success message and sets the SSH_SESSION_FLAG_AUTHENTICATED flag."
          },
          {
            "order": 2,
            "evidence_ir": "IR-011",
            "action": "The client connection callback (ssh_client_connection_callback) is triggered.",
            "result": "The client transitions its internal state to SSH_SESSION_STATE_AUTHENTICATED at src/client.c:442 because the flag is set, potentially leading to unexpected behavior in the calling application."
          }
        ]
      },
      "sink": {
        "function": "ssh_client_connection_callback",
        "file": "src/client.c",
        "line": 440,
        "evidence_ir_id": "IR-011",
        "sink_type": "state_corruption"
      },
      "impact": {
        "category": "integrity_violation",
        "description": "A malicious server can trick a libssh client into believing it is authenticated before the protocol has reached that stage, potentially bypassing client-side security checks."
      },
      "verdict": {
        "exploitability": "medium",
        "reason": "Requires a malicious server or a Man-in-the-Middle to inject the packet into a client session."
      },
      "confidence": "high",
      "uncertainty": "While the CVE is primarily known for the server-side bypass, the IRs for the client-side (IR-011) show the exact same logical vulnerability exists in the client state machine."
    },
    {
      "id": "AS-003",
      "title": "Post-Bypass Resource Manipulation (Channel Data)",
      "exploit_chain": {
        "steps": [
          {
            "order": 1,
            "evidence_ir": "IR-026",
            "action": "Attacker performs the authentication bypass described in AS-001.",
            "result": "The session is now in the AUTHENTICATED state."
          },
          {
            "order": 2,
            "evidence_ir": "IR-006",
            "action": "Attacker sends SSH_MSG_CHANNEL_DATA packets to a channel ID they have guessed or opened.",
            "result": "The server processes the data and buffers it for the (unauthorized) session."
          }
        ]
      },
      "sink": {
        "function": "channel_default_bufferize",
        "file": "src/channels.c",
        "line": 811,
        "evidence_ir_id": "IR-006",
        "sink_type": "unknown"
      },
      "impact": {
        "category": "integrity_violation",
        "description": "Allows an unauthenticated attacker to interact with channel buffers, which is a direct consequence of the authentication bypass."
      },
      "verdict": {
        "exploitability": "high",
        "reason": "This is a secondary effect of the primary auth bypass."
      },
      "confidence": "high",
      "uncertainty": "The sink is 'unknown' because it is a standard operation (bufferizing data) that only becomes harmful because the session state was illegally transitioned to authenticated."
    },
    {
      "id": "AS-004",
      "title": "Potential Heap Corruption in Unimplemented Packet Handler",
      "exploit_chain": {
        "steps": [
          {
            "order": 1,
            "evidence_ir": "IR-029",
            "action": "Attacker sends a SSH2_MSG_UNIMPLEMENTED packet containing a string with a large, attacker-controlled length field.",
            "result": "The system attempts to unpack the string using ssh_buffer_unpack_va."
          }
        ]
      },
      "sink": {
        "function": "ssh_buffer_unpack_va",
        "file": "src/buffer.c",
        "line": 1135,
        "evidence_ir_id": "IR-029",
        "sink_type": "memory_write"
      },
      "impact": {
        "category": "memory_corruption",
        "description": "Potential heap overflow or out-of-memory condition when processing malformed packets."
      },
      "verdict": {
        "exploitability": "low",
        "reason": "The code contains a check (len > max_len - 1), but the IR suggests the length is still attacker-controlled and used in a malloc-like context."
      },
      "confidence": "medium",
      "uncertainty": "This is a distinct vulnerability from the main CVE-2018-10933 logic but is present in the provided IRs. It is included for coverage of high-confidence sinks."
    }
  ]
}
