{
  "schema_version": "v1",
  "project": "lwip",
  "cve": "CVE-2020-22283",
  "attack_scenarios": [
    {
      "id": "AS-001",
      "title": "Remote double-free via TCP persist mode + memory pressure (CVE-2020-22283)",
      "exploit_chain": {
        "steps": [
          {
            "order": 1,
            "evidence_ir": "IR-001",
            "action": "Attacker establishes a TCP connection to an lwIP-based device and sends an ACK with wnd=0. This drives the receiver's PCB into persist mode (pcb->persist_backoff is incremented from 0 to 1 on the next tcp_slowtmr tick, pcb->persist_cnt starts counting).",
            "result": "PCB is in persist mode: persist_backoff > 0. tcp_slowtmr will repeatedly fire persist probes instead of normal retransmission."
          },
          {
            "order": 2,
            "evidence_ir": "IR-001",
            "action": "Attacker sends a follow-up ACK with wnd=small_nonzero (e.g. wnd=1..MSS-1). tcp_input at src/core/tcp_in.c:118 receives the packet; tcp_receive at src/core/tcp_in.c:1169 executes pcb->snd_wnd = SND_WND_SCALE(pcb, tcphdr->wnd), writing the attacker-chosen value.",
            "result": "pcb->snd_wnd is set to a small positive value. PCB has: persist_backoff > 0, snd_wnd > 0, unsent data queued."
          },
          {
            "order": 3,
            "evidence_ir": "IR-001",
            "action": "Attacker concurrently induces MEMP_TCP_SEG pool exhaustion — e.g. by opening many half-open connections (SYN flood to exhaust tcp_seg memp slots) or by sending many small segments to the same or different PCBs.",
            "result": "MEMP_TCP_SEG pool is at or near capacity. The next memp_malloc(MEMP_TCP_SEG) inside tcp_create_segment will return NULL."
          },
          {
            "order": 4,
            "evidence_ir": "IR-002",
            "action": "tcp_slowtmr fires (every 500 ms via tcp_tmr at src/core/tcp.c:234→242). The persist-backoff counter reaches its threshold (tcp_persist_backoff[persist_backoff-1]). Because snd_wnd != 0, the else-branch at src/core/tcp.c:1257 is taken and tcp_split_unsent_seg(pcb, (u16_t)pcb->snd_wnd) is called.",
            "result": "Control enters tcp_split_unsent_seg (src/core/tcp_out.c:827) with split == snd_wnd."
          },
          {
            "order": 5,
            "evidence_ir": "IR-002",
            "action": "tcp_split_unsent_seg allocates remainder pbuf p via pbuf_alloc at src/core/tcp_out.c:877, then calls tcp_create_segment(pcb, p, ...) at line 914. Inside tcp_create_segment, memp_malloc(MEMP_TCP_SEG) fails at line 168 due to pool exhaustion; pbuf_free(p) is called at line 170, and NULL is returned.",
            "result": "p has been freed once. tcp_create_segment returns NULL."
          },
          {
            "order": 6,
            "evidence_ir": "IR-002",
            "action": "Back in tcp_split_unsent_seg: seg == NULL at line 915, so 'goto memerr' is executed at line 918. At the memerr label (line 981), the check 'if (p != NULL) pbuf_free(p)' at line 986 is executed. p is non-NULL (it was never set to NULL after the tcp_create_segment failure) but already freed.",
            "result": "pbuf_free(p) is called a second time — double-free. The pbuf pool (PBUF_POOL or custom allocator) receives a free of a pointer it no longer owns. This corrupts the allocator free-list or reference counts."
          }
        ]
      },
      "sink": {
        "function": "tcp_split_unsent_seg",
        "file": "src/core/tcp_out.c",
        "line": 986,
        "sink_type": "memory_write"
      },
      "impact": {
        "category": "memory_corruption",
        "description": "Double-free of a pbuf in lwIP's packet buffer pool. Consequence depends on the pbuf pool implementation used by the integrator: in memp-pool configurations this corrupts the memp free-list; in heap configurations this is a classic double-free heap corruption. On embedded targets (the primary lwIP deployment environment) memory layouts are predictable, making controlled corruption and RCE feasible. At minimum: crash / DoS of the embedded network stack. The Savannah bug report (bug #57377) classifies the cluster as OOM/double-free with potential for memory corruption beyond a crash."
      },
      "verdict": {
        "exploitability": "high",
        "reason": "Fully network-triggered: two TCP ACK packets (one with wnd=0, one with wnd>0) plus concurrent resource pressure. All inputs come from TCP header fields. The timer delay (500 ms to several seconds for persist backoff) is not a meaningful barrier. Resource exhaustion is achievable via SYN flood or many short connections. The attack surface is any TCP server application built on lwIP <= 2.1.2 accessible over the network."
      },
      "confidence": "high",
      "uncertainty": "Actual memory corruption consequence depends on the pbuf allocator backend (memp-pool vs heap) and the integrator's MEMP_NUM_PBUF / MEMP_NUM_TCP_SEG configuration. On constrained embedded targets these pools are often small, making exhaustion straightforward. Exploitation beyond crash to controlled execution requires knowledge of the specific memory layout."
    }
  ]
}
