{
  "schema_version": "v1",
  "project": "u-boot",
  "cve": "CVE-2018-3968",
  "attack_scenarios": [
    {
      "id": "AS-001",
      "title": "Verified-boot bypass via legacy uImage on U-Boot built with CONFIG_FIT_SIGNATURE",
      "exploit_chain": {
        "steps": [
          {
            "order": 1,
            "evidence_ir": "IR-001",
            "action": "Attacker has write access to a boot medium consumed by the target U-Boot installation: the on-board NAND/SPI/eMMC, a removable USB/SD, a TFTP/DHCP server reachable on the boot network, or a writable boot script (boot.scr). The board is configured with CONFIG_FIT and CONFIG_FIT_SIGNATURE so the operator believes only RSA-signed FIT kernels can boot.",
            "result": "Attacker controls the bytes that will sit at the bootm load address (load_addr) on the next boot."
          },
          {
            "order": 2,
            "evidence_ir": "IR-001",
            "action": "Attacker crafts a legacy uImage: a 64-byte header starting with the magic 0x27051956 (IH_MAGIC, include/image.h:239), an arbitrary OS / arch / type field, the attacker's unsigned kernel as the data payload, and CRC32 values in ih_hcrc / ih_dcrc computed over the header and data respectively. CRC32 is an integrity hash, not a signature — the attacker computes the matching CRCs themselves. Crucially, the attacker does NOT need a private key or any signature material.",
            "result": "A single contiguous blob whose first 4 bytes are IH_MAGIC, whose CRCs match its own contents, and whose payload is an arbitrary kernel chosen by the attacker."
          },
          {
            "order": 3,
            "evidence_ir": "IR-001",
            "action": "Board boots. The bootcmd (or operator) issues the bootm command. U_BOOT_CMD-registered handler do_bootm at common/cmd_bootm.c:786 runs. do_bootm calls do_bootm_states (line 825) → bootm_find_os (line 646) → boot_get_kernel (line 224). boot_get_kernel calls genimg_get_format (common/cmd_bootm.c:954) on the attacker's blob.",
            "result": "Control reaches genimg_get_format with the attacker-supplied bytes."
          },
          {
            "order": 4,
            "evidence_ir": "IR-001",
            "action": "genimg_get_format at common/image.c:655 inspects the first 4 bytes via image_check_magic (line 661). They equal IH_MAGIC, so at line 662 format is set to IMAGE_FORMAT_LEGACY. The function returns LEGACY without consulting CONFIG_FIT_SIGNATURE and without examining the rest of the image.",
            "result": "The format dispatch in boot_get_kernel takes the IMAGE_FORMAT_LEGACY branch. This is the structural moment of bypass: the operator-set FIT signature requirement is silently ignored because the format-selection routine has no signature-required precondition."
          },
          {
            "order": 5,
            "evidence_ir": "IR-001",
            "action": "boot_get_kernel's case IMAGE_FORMAT_LEGACY (line 955) calls image_get_kernel(img_addr, images->verify) at line 958. image_get_kernel at common/cmd_bootm.c:862 walks the legacy header: image_check_magic again at line 866, image_check_hcrc at line 873, image_check_dcrc at line 884. All three are CRC32 integrity checks computed with publicly known constants — the attacker-built header passes all three trivially. No call to fit_image_verify, fit_image_check_sig, or rsa_verify is made on this branch.",
            "result": "image_get_kernel returns the legacy header pointer. boot_get_kernel commits the attacker's payload as os_data / os_len (lines 967-968 / 971 / 974-975 depending on image type). bootm_find_os populates images.os.{type,comp,os,end,load} from the same attacker-controlled header."
          },
          {
            "order": 6,
            "evidence_ir": "IR-001",
            "action": "do_bootm_states proceeds through BOOTM_STATE_LOADOS (line 654), invoking bootm_load_os(images, &load_end, 0) at line 658, which copies / decompresses the attacker's kernel data into the load address. Eventually the function looks up boot_fn = boot_os[images->os.os] (line 696) and the OS_GO state jumps into the kernel.",
            "result": "The unsigned attacker-supplied kernel is loaded and executed with full U-Boot privileges. The chain of trust the operator believed was enforced (signed FIT only) is fully broken."
          }
        ]
      },
      "sink": {
        "function": "genimg_get_format",
        "file": "common/image.c",
        "line": 662,
        "evidence_ir_id": "IR-001",
        "sink_type": "auth_bypass"
      },
      "impact": {
        "category": "privilege_bypass",
        "description": "Verified-boot bypass (CWE-347 Improper Verification of Cryptographic Signature). Attacker who can supply a boot image to a U-Boot install configured with CONFIG_FIT_SIGNATURE causes the device to load and execute an unsigned, attacker-chosen kernel. The kernel runs with the privileges of the boot loader (typically supervisor mode, full memory access) and can persist by re-flashing further code or by impersonating a legitimate signed boot. The original report (Cisco Talos against the Cujo Smart Firewall) demonstrated arbitrary kernel execution on a device that advertised verified boot."
      },
      "verdict": {
        "exploitability": "high",
        "reason": "No cryptographic primitive is needed — the attacker only needs to compute CRC32 values over their own payload, which is publicly defined. No timing, no race, no memory corruption: a single deterministic structural bypass. The entry surface is broad (any writable boot medium suffices). The fix had to be a structural change (introduce CONFIG_IMAGE_FORMAT_LEGACY and gate the entire legacy code path on it), confirming the bug was a missing-feature vulnerability, not a corner case."
      },
      "confidence": "high",
      "uncertainty": "Real-world impact varies by deployment: which boot medium is writable, whether downstream silicon has a separate secure-boot ROM upstream of U-Boot, and what the unsigned kernel does once it has control. None of those affect U-Boot's primitive: at the U-Boot layer the bypass is unconditional given CONFIG_FIT_SIGNATURE + writable boot medium."
    }
  ]
}
