{
  "schema_version": "v1",
  "project": "sudo",
  "cve": "CVE-2021-3156",
  "attack_scenarios": [
    {
      "id": "AS-001",
      "title": "Local privilege escalation to root via heap overflow in sudoedit argument unescape loop",
      "exploit_chain": {
        "steps": [
          {
            "order": 1,
            "evidence_ir": "IR-001",
            "action": "Attacker (any local user, no sudoers entry required) invokes either 'sudoedit -s cmd arg\\ nextarg' OR 'sudoedit -i cmd arg\\ nextarg' where 'arg\\' ends in a single backslash and 'nextarg' is a further argument. With '-s' MODE_SHELL is set directly by parse_args; with '-i' MODE_LOGIN_SHELL is set and parse_args.c:549-560 then SETs MODE_SHELL as well. In both shapes sudoedit sets MODE_EDIT, so the combined flags reach the vulnerable branch identically.",
            "result": "The sudo front-end calls the policy plugin with argc/argv = ['cmd', 'arg\\', 'nextarg', NULL]. sudo_mode = MODE_EDIT|MODE_SHELL."
          },
          {
            "order": 2,
            "evidence_ir": "IR-001",
            "action": "sudoers_policy_check (plugins/sudoers/policy.c:1013) calls sudoers_policy_main (plugins/sudoers/sudoers.c:332), which calls set_cmnd() (line 401) BEFORE any sudoers policy check. set_cmnd() allocates user_args = malloc(size) where size = strlen('arg\\') + 1 + strlen('nextarg') + 1 (lines 958-960).",
            "result": "user_args is allocated with exact fit for the expected output. The heap object immediately follows other heap metadata."
          },
          {
            "order": 3,
            "evidence_ir": "IR-001",
            "action": "The unescape loop at line 964 is entered (ISSET(sudo_mode, MODE_SHELL|MODE_LOGIN_SHELL) is TRUE). For 'arg\\': at the backslash position, from[0]='\\\\', from[1]='\\0', !isspace('\\0')=TRUE → from++ (advances past null into 'nextarg' in contiguous argv memory). *to++ = *from++ copies the null byte to user_args AND advances from into 'nextarg'. The while loop continues, copying 'nextarg' bytes into user_args.",
            "result": "The outer for-loop then also iterates av++ to 'nextarg' and processes it normally. 'nextarg' is written into user_args TWICE — once from the runoff and once from the av++ iteration. Total bytes written exceed size by strlen('nextarg')."
          },
          {
            "order": 4,
            "evidence_ir": "IR-001",
            "action": "The overflow at line 974 (*to++ = *from++) writes bytes past user_args + size into adjacent heap memory. The attacker controls both the overflow amount (length of 'nextarg') and the overflow content (content of 'nextarg'). By crafting the argument sizes to align with heap allocator metadata, the attacker corrupts heap control structures or function pointers.",
            "result": "Heap corruption. With careful argument sizing, the attacker overwrites an adjacent heap object (e.g. a function pointer or size field in a sudoers data structure). Public PoCs (Qualys, GitHub) demonstrate reliable root code execution by corrupting specific heap allocations made before user_args."
          }
        ]
      },
      "sink": {
        "function": "set_cmnd",
        "file": "plugins/sudoers/sudoers.c",
        "line": 974,
        "sink_type": "memory_write"
      },
      "impact": {
        "category": "memory_corruption",
        "description": "Heap-based buffer overflow in set_cmnd(). sudo is setuid-root; the overflow happens before any credential or sudoers check, so it is reachable by any local user. Public Qualys PoC achieves full root privilege escalation (local-to-root). CVSS 3.1 base score 7.8 (local, no special privileges, confirmed public exploit)."
      },
      "verdict": {
        "exploitability": "high",
        "reason": "Single command invocation, no sudoers privileges required, attacker controls allocation size and overflow content via argv. Public exploits exist (Qualys PoC, multiple GitHub repos). The vulnerability affects all Linux/Unix distributions with sudo < 1.9.5p2 / 1.8.32."
      },
      "confidence": "high",
      "uncertainty": "Exact exploitation technique (which heap object is targeted) depends on the heap allocator (glibc malloc vs musl vs jemalloc) and the sudo version's specific heap layout. The overflow condition itself is deterministic and confirmed by the patch and Qualys advisory."
    }
  ]
}
