{
  "schema_version": "v1",
  "project": "dnsmasq",
  "cve": "CVE-2017-14491",
  "attack_scenarios": [
    {
      "id": "AS-001",
      "title": "Heap buffer overflow in DNS response builder triggered by remote UDP query",
      "exploit_chain": {
        "steps": [
          {
            "order": 1,
            "evidence_ir": "IR-001",
            "action": "Attacker sends a UDP DNS query to a dnsmasq-host that is configured with at least one auth/local zone, where the queried name (or names of records dnsmasq will return) is crafted so that encoding their concatenation into the response buffer plus the fixed 12-byte tail exceeds the negotiated UDP size by 1-2 bytes.",
            "result": "receive_query (src/forward.c:1117) reads the bytes via recvmsg, parses the header, and routes the query into the local-answer branch."
          },
          {
            "order": 2,
            "evidence_ir": "IR-001",
            "action": "receive_query at src/forward.c:1439 calls answer_request(header, header + udp_size, ...) — the second argument is the buffer 'limit' the response builder should respect.",
            "result": "Control enters answer_request (src/rfc1035.c:1209), which iterates the answer set and calls add_resource_record per RR."
          },
          {
            "order": 3,
            "evidence_ir": "IR-001",
            "action": "add_resource_record (src/rfc1035.c:1065) advances its local cursor 'p' through PUTSHORT and do_rfc1035_name calls without ever testing (p + size <= limit). For the crafted answer set, the per-write sequence walks past the buffer end.",
            "result": "Heap is written past the response buffer. The first +2 bytes of overflow originate from one of the unconditional PUTSHORT writes at src/rfc1035.c:1082, 1097, or 1102; longer overflows originate from do_rfc1035_name's *p++ loop (src/util.c:257)."
          },
          {
            "order": 4,
            "evidence_ir": "IR-001",
            "action": "Depending on heap layout, the 2 bytes overwrite metadata of an adjacent allocation owned by dnsmasq.",
            "result": "Crash (DoS) at minimum; controlled corruption (RCE in dnsmasq's address space) is feasible per the original Google advisory because dnsmasq's heap layout is predictable enough to overlap with function pointers in adjacent allocations."
          }
        ]
      },
      "sink": {
        "function": "add_resource_record",
        "file": "src/rfc1035.c",
        "line": 1102,
        "evidence_ir_id": "IR-001",
        "sink_type": "memory_write"
      },
      "impact": {
        "category": "memory_corruption",
        "description": "2-byte heap buffer overflow in dnsmasq's DNS response construction. Original Google advisory and the dnsmasq fix commit message both describe this as 'crash, or even take control of, dnsmasq'. dnsmasq commonly runs as root in router/embedded deployments, so RCE here is a privileged-process compromise."
      },
      "verdict": {
        "exploitability": "high",
        "reason": "Single UDP packet, unauthenticated, remote. PoCs exist publicly. The patch is a defense-in-depth audit (CHECK_LIMIT before every write), indicating the gap is structural across many call sites, not a corner case."
      },
      "confidence": "high",
      "uncertainty": "Whether the +2-byte spill yields RCE depends on glibc/musl heap layout and on what dnsmasq has allocated immediately after the response buffer. This is environment-specific and outside the scope of the labeled-source claims."
    },
    {
      "id": "AS-002",
      "title": "Same primitive over TCP DNS",
      "exploit_chain": {
        "steps": [
          {
            "order": 1,
            "evidence_ir": "IR-002",
            "action": "Attacker opens a TCP DNS connection to dnsmasq and sends one or more framed queries against an auth/local zone, with the same crafted name shapes as AS-001.",
            "result": "tcp_request (src/forward.c:1604) reads each framed query."
          },
          {
            "order": 2,
            "evidence_ir": "IR-002",
            "action": "tcp_request at src/forward.c:1774 calls answer_request(header, header + 65536, ...) and answer_request walks the same add_resource_record path as AS-001.",
            "result": "Same heap overflow primitive at the same sink lines."
          }
        ]
      },
      "sink": {
        "function": "add_resource_record",
        "file": "src/rfc1035.c",
        "line": 1082,
        "evidence_ir_id": "IR-002",
        "sink_type": "memory_write"
      },
      "impact": {
        "category": "memory_corruption",
        "description": "Same memory_corruption primitive as AS-001 reached over TCP. Larger buffer (65535) somewhat reduces the practical pressure to overflow on common inputs but the structural gap is identical."
      },
      "verdict": {
        "exploitability": "medium",
        "reason": "Reachable but generally less attractive than the UDP path because TCP DNS has a larger buffer and is rate-limited by accept/connect rather than fire-and-forget UDP."
      },
      "confidence": "high",
      "uncertainty": "Attack surface depends on whether the deployment exposes TCP/53; many embedded dnsmasq configurations do."
    }
  ]
}
