{
  "schema_version": "v1",
  "project": "dnsmasq",
  "cve": "CVE-2017-14491",
  "attack_scenarios": [
    {
      "id": "AS-001",
      "title": "Heap Buffer Overflow in DNS Authoritative Response via UDP",
      "exploit_chain": {
        "steps": [
          {
            "order": 1,
            "evidence_ir": "IR-012",
            "action": "Attacker sends a DNS query for a PTR record within an authoritative zone via UDP.",
            "result": "The system dispatches the request to answer_auth to construct a response in the global daemon->packet buffer."
          },
          {
            "order": 2,
            "evidence_ir": "IR-012",
            "action": "answer_auth calls add_resource_record to append the PTR record data.",
            "result": "add_resource_record performs a memcpy into the buffer without checking the 'limit' until after the write."
          }
        ]
      },
      "sink": {
        "function": "add_resource_record",
        "file": "src/rfc1035.c",
        "line": 1158,
        "evidence_ir_id": "IR-012",
        "sink_type": "memory_write"
      },
      "impact": {
        "category": "memory_corruption",
        "description": "Heap-based buffer overflow allowing remote code execution or denial of service."
      },
      "verdict": {
        "exploitability": "high",
        "reason": "The sink performs a write before checking the buffer limit, and the input is directly provided by an unauthenticated network packet."
      },
      "confidence": "high",
      "uncertainty": "None"
    },
    {
      "id": "AS-002",
      "title": "Heap Buffer Overflow in DNS Authoritative Response via TCP",
      "exploit_chain": {
        "steps": [
          {
            "order": 1,
            "evidence_ir": "IR-015",
            "action": "Attacker sends a large DNS query (up to 64KB) over TCP targeting an authoritative zone.",
            "result": "The system allocates a 64KB buffer and calls answer_auth to populate the response."
          },
          {
            "order": 2,
            "evidence_ir": "IR-015",
            "action": "answer_auth repeatedly calls add_resource_record to append multiple records.",
            "result": "The cumulative size of records exceeds the 64KB buffer because the limit check in add_resource_record occurs after the OOB write."
          }
        ]
      },
      "sink": {
        "function": "add_resource_record",
        "file": "src/rfc1035.c",
        "line": 1146,
        "evidence_ir_id": "IR-015",
        "sink_type": "memory_write"
      },
      "impact": {
        "category": "memory_corruption",
        "description": "Heap-based buffer overflow in the TCP response path."
      },
      "verdict": {
        "exploitability": "high",
        "reason": "TCP allows for larger payloads and multiple records, increasing the likelihood of exceeding the allocated heap buffer."
      },
      "confidence": "high",
      "uncertainty": "None"
    },
    {
      "id": "AS-003",
      "title": "Heap Buffer Overflow in TFTP Netascii Expansion",
      "exploit_chain": {
        "steps": [
          {
            "order": 1,
            "evidence_ir": "IR-026",
            "action": "Attacker initiates a TFTP transfer in 'netascii' mode and sends a packet containing many newline characters.",
            "result": "The system calls get_block to process the data and expand '\\n' to '\\r\\n'."
          },
          {
            "order": 2,
            "evidence_ir": "IR-026",
            "action": "get_block uses memmove to shift data for the expansion without verifying the new size against daemon->packet_buff_sz.",
            "result": "A heap overflow occurs in the global packet buffer."
          }
        ]
      },
      "sink": {
        "function": "get_block",
        "file": "src/tftp.c",
        "line": 778,
        "evidence_ir_id": "IR-026",
        "sink_type": "memory_write"
      },
      "impact": {
        "category": "memory_corruption",
        "description": "Heap overflow via controlled expansion of characters in the TFTP buffer."
      },
      "verdict": {
        "exploitability": "high",
        "reason": "The expansion logic lacks any bounds check against the destination buffer size."
      },
      "confidence": "high",
      "uncertainty": "None"
    },
    {
      "id": "AS-004",
      "title": "Heap Buffer Overflow in DHCPv6 Relay Forwarding",
      "exploit_chain": {
        "steps": [
          {
            "order": 1,
            "evidence_ir": "IR-005",
            "action": "Attacker sends a crafted DHCPv6 RELAY-FORWARD packet with large nested options.",
            "result": "The system calls relay_upstream6 to construct a relayed packet."
          },
          {
            "order": 2,
            "evidence_ir": "IR-005",
            "action": "relay_upstream6 calls put_opt6 to copy the original packet into the new relay message.",
            "result": "The memcpy in put_opt6/relay_upstream6 overflows the outpacket buffer because the size is not validated against the buffer's capacity."
          }
        ]
      },
      "sink": {
        "function": "memcpy",
        "file": "src/rfc3315.c",
        "line": 2101,
        "evidence_ir_id": "IR-005",
        "sink_type": "memory_write"
      },
      "impact": {
        "category": "memory_corruption",
        "description": "Heap overflow during DHCPv6 relaying."
      },
      "verdict": {
        "exploitability": "medium",
        "reason": "Requires DHCPv6 relaying to be enabled and specific packet nesting."
      },
      "confidence": "high",
      "uncertainty": "None"
    },
    {
      "id": "AS-005",
      "title": "Stack Buffer Overflow in ICMP Echo Reply Handling",
      "exploit_chain": {
        "steps": [
          {
            "order": 1,
            "evidence_ir": "IR-009",
            "action": "Attacker sends a crafted ICMP Echo Reply packet with IP options to the socket handled by delay_dhcp.",
            "result": "The system calls recvfrom to read the packet into a stack-allocated structure."
          },
          {
            "order": 2,
            "evidence_ir": "IR-009",
            "action": "The kernel returns a packet larger than the 'struct ip + struct icmp' definition due to IP options.",
            "result": "recvfrom writes past the end of the stack-allocated 'packet' variable."
          }
        ]
      },
      "sink": {
        "function": "recvfrom",
        "file": "src/dnsmasq.c",
        "line": 1875,
        "evidence_ir_id": "IR-009",
        "sink_type": "memory_write"
      },
      "impact": {
        "category": "memory_corruption",
        "description": "Stack-based buffer overflow."
      },
      "verdict": {
        "exploitability": "medium",
        "reason": "Exploitability depends on the kernel's behavior regarding raw socket packet sizes and IP options."
      },
      "confidence": "high",
      "uncertainty": "While recvfrom uses sizeof(packet), the vulnerability in this CVE often involves the mismatch between the fixed struct size and the actual data returned by the kernel when options are present."
    }
  ]
}
