{
  "schema_version": "v1",
  "project": "mbedtls",
  "cve": "CVE-2018-0488",
  "attack_scenarios": [
    {
      "id": "AS-001",
      "title": "Remote heap corruption via truncated HMAC overflow in TLS CBC decryption",
      "exploit_chain": {
        "steps": [
          {
            "order": 1,
            "evidence_ir": "IR-001",
            "action": "Attacker connects to a mbedtls-based TLS server (or operates a malicious server targeting a mbedtls client) and proposes a CBC ciphersuite (e.g. TLS_RSA_WITH_AES_128_CBC_SHA) and the TLS Truncated HMAC extension (RFC 6066) during the handshake.",
            "result": "Handshake completes. mbedtls_ssl_setup_transform sets transform->maclen = MBEDTLS_SSL_TRUNCATED_HMAC_LEN = 10 (ssl_tls.c:712-713) instead of the full SHA-1 digest size of 20. ssl->transform_in is now non-NULL."
          },
          {
            "order": 2,
            "evidence_ir": "IR-001",
            "action": "Attacker sends any TLS application data record over the established connection.",
            "result": "The victim application calls mbedtls_ssl_read() (ssl_tls.c:6759). This calls mbedtls_ssl_read_record() at line 6861 → mbedtls_ssl_read_record_layer() at line 3734 → ssl_prepare_record_content() at line 3936. The guard at ssl_prepare_record_content:3675 (!done && ssl->transform_in != NULL) is satisfied, so ssl_decrypt_buf() is called at line 3677."
          },
          {
            "order": 3,
            "evidence_ir": "IR-001",
            "action": "Inside ssl_decrypt_buf, MAC verification computes the expected HMAC. At line 1968, mbedtls_md_hmac_finish writes the full SHA-1 digest (20 bytes) to ssl->in_msg + ssl->in_msglen.",
            "result": "The record buffer at ssl->in_msg + ssl->in_msglen only has 10 bytes allocated for the MAC (transform->maclen=10). mbedtls_md_hmac_finish writes 20 bytes, overflowing by 10 bytes into adjacent heap memory. For SHA-256 the overflow is 22 bytes."
          },
          {
            "order": 4,
            "evidence_ir": "IR-001",
            "action": "The heap overflow corrupts memory adjacent to the inbound TLS record buffer.",
            "result": "Heap corruption. The ChangeLog for mbedtls 2.7.0 describes the impact as allowing an attacker to selectively corrupt bytes on the peer's heap. Depending on heap layout and allocator, this can be leveraged for arbitrary code execution or denial of service. The vulnerability affects both server and client roles since ssl_encrypt_buf has a symmetric issue at line 1301."
          }
        ]
      },
      "sink": {
        "function": "ssl_decrypt_buf",
        "file": "library/ssl_tls.c",
        "line": 1968,
        "sink_type": "memory_write"
      },
      "impact": {
        "category": "memory_corruption",
        "description": "Heap-based buffer overflow (CWE-122). Remote attacker can corrupt 10-22 bytes of heap memory adjacent to the inbound TLS record buffer on the victim process, leading to potential arbitrary code execution or denial of service."
      },
      "verdict": {
        "exploitability": "high",
        "reason": "No authentication or special privilege required beyond establishing a TLS connection. Truncated HMAC is a standard TLS extension enabled by default in mbedtls config.h. The overflow is deterministic and occurs on every application data receive after a qualifying handshake. Both client and server roles are affected."
      },
      "confidence": "high",
      "uncertainty": "Exploitability beyond heap corruption depends on heap layout and allocator hardening, which is runtime-specific. The overflow itself (memory_write past buffer end) is unconditional given the preconditions."
    }
  ]
}
