{
  "schema_version": "v1",
  "project": "nginx",
  "cve": "CVE-2025-23419",
  "attack_scenarios": [
    {
      "id": "AS-001",
      "title": "Client certificate authentication bypass via TLS 1.3 cross-SNI session resumption",
      "exploit_chain": {
        "steps": [
          {
            "order": 1,
            "evidence_ir": "IR-001",
            "action": "Operator deploys nginx ≥1.11.4 (mainline before 1.27.4) or 1.26.x before 1.26.3 with two name-based virtual servers sharing the same IP:port. Vhost A is the default or a permissive vhost (no `ssl_verify_client`); vhost B has `ssl_verify_client on; ssl_client_certificate /path/to/ca.pem;` and serves a sensitive endpoint. The build uses OpenSSL ≥1.1.1; TLS 1.3 and session resumption (`ssl_session_tickets on` or shared `ssl_session_cache`) are enabled (defaults).",
            "result": "Both vhosts share a single OpenSSL session-ticket-encryption key (and session cache, if configured). The default SSL_CTX (vhost A's, by virtue of being default) is the one OpenSSL uses for session resumption."
          },
          {
            "order": 2,
            "evidence_ir": "IR-001",
            "action": "Attacker, a network peer with TCP reachability to the listen address, opens a TLS 1.3 connection to vhost A. They send SNI for vhost A. ngx_http_init_connection (src/http/ngx_http_request.c:200) accepts the connection; ngx_http_ssl_handshake → ngx_ssl_handshake → SSL_do_handshake (src/event/ngx_event_openssl.c:1721) drives the handshake; ngx_http_ssl_servername (line 875) is invoked, finds vhost A via ngx_http_find_virtual_server (line 924), commits hc->conf_ctx (line 942), swaps SSL_CTX (line 953). Vhost A does not require a client cert, so the handshake completes normally. OpenSSL issues a session ticket bound to vhost A's session.",
            "result": "Attacker holds a valid TLS 1.3 session ticket for vhost A. The session was established under the default SSL_CTX with vhost A's verify mode (no client cert required)."
          },
          {
            "order": 3,
            "evidence_ir": "IR-001",
            "action": "Attacker opens a fresh TCP connection to the same IP:port. In ClientHello they (a) present the session ticket from step 2 and (b) send SNI for *vhost B*. ngx_http_init_connection runs again; SSL_do_handshake processes ClientHello. Because of TLS 1.3 + OpenSSL semantics, OpenSSL performs session *resumption* inside the default SSL_CTX (vhost A's) BEFORE the SNI callback fires.",
            "result": "The session is resumed under vhost A's verify policy (no client cert required). At this point in the OpenSSL state machine, the session is effectively already established — only the SNI callback has yet to run."
          },
          {
            "order": 4,
            "evidence_ir": "IR-001",
            "action": "OpenSSL invokes ngx_http_ssl_servername (line 875). SSL_get_servername (line 895) returns vhost B's name (in TLS 1.3 the resumed handshake also negotiates servername, unlike TLS 1.2 where SSL_get_servername returned the original name — this is the regression that makes the b720f650b restriction insufficient). ngx_http_find_virtual_server (line 924) finds vhost B's cscf. The vulnerable code then reaches line 933 (NGX_DECLINED bail-out closing brace) and falls through to line 935 — the *first action past the missing cross-SNI guard*.",
            "result": "**Bypass moment:** the function commits hc->ssl_servername at line 935, hc->conf_ctx = cscf->ctx at line 942, SSL_set_SSL_CTX at line 953, and SSL_set_verify (with vhost B's verify mode, line 962-963). But these calls only set future verify state; the resumed session, already past the resumption decision, retains vhost A's no-cert policy."
          },
          {
            "order": 5,
            "evidence_ir": "IR-001",
            "action": "Handshake completes successfully. Attacker is now connected to vhost B with a session that was originally established for vhost A and never presented a client certificate. Attacker issues HTTP requests to vhost B's endpoints — ssl_verify_client, $ssl_client_s_dn, and any auth_request module gating that depends on client cert variables sees no certificate (or vhost A's cert if the attacker presented one then).",
            "result": "Attacker reaches vhost B's protected endpoints without satisfying its client cert authentication requirement. Equivalent to logging in as an arbitrary client of vhost B."
          },
          {
            "order": 6,
            "evidence_ir": "IR-001",
            "action": "Symmetrically, the same attack works on the stream module: nginx -with-stream_ssl_module configurations with multiple vhosts sharing IP/port suffer the same cross-SNI resumption bypass via ngx_stream_ssl_servername at src/stream/ngx_stream_ssl_module.c:534. Both modules are patched in commit 46b9f5d3.",
            "result": "Same authentication bypass effect for stream-proxied TLS services (e.g. database/SMTP/AMQP TLS termination) configured with name-based vhosts and client-cert auth on a subset."
          }
        ]
      },
      "sink": {
        "function": "ngx_http_ssl_servername",
        "file": "src/http/ngx_http_request.c",
        "line": 935,
        "evidence_ir_id": "IR-001",
        "sink_type": "auth_bypass"
      },
      "impact": {
        "category": "privilege_bypass",
        "description": "TLS 1.3 cross-SNI session-resumption authentication bypass (CWE-287 Improper Authentication / CWE-863 Incorrect Authorization). Network attacker reaches a vhost requiring client certificates without presenting one, by first establishing a session with a permissive vhost on the same IP/port and then resuming the session against the strict vhost. Effective scope is whatever the strict vhost protects: API endpoints, admin panels, mTLS-gated database connections (stream module). The bypass is fully passive on the strict vhost — its access logs may not show any anomaly because the connection looks like a normal resumed session."
      },
      "verdict": {
        "exploitability": "high",
        "reason": "No cryptographic compromise needed: attacker gets a session ticket from a public-facing permissive vhost (often the default vhost or a marketing site) and resumes against the protected vhost. No race, no parser corner case, no special PoC tooling beyond a TLS client capable of presenting a session ticket and overriding SNI on resumption (curl --tls-max 1.3 --resolve / openssl s_client -sess_in / etc.). Affected configurations are common (any deployment with shared listen + per-name client-cert policy)."
      },
      "confidence": "high",
      "uncertainty": "Real-world prevalence depends on operator configuration. Many production deployments with strict ssl_verify_client place each protected service on its own listen IP/port (which is also the documented operator workaround) — those are unaffected. Deployments with name-based vhost sharding on a single IP/port are exactly the configurations the CVE targets."
    }
  ]
}
