{
  "schema_version": "v1",
  "project": "libssh",
  "cve": "CVE-2018-10933",
  "attack_scenarios": [
    {
      "id": "AS-001",
      "title": "Server-side authentication bypass by sending SSH2_MSG_USERAUTH_SUCCESS to a libssh server",
      "exploit_chain": {
        "steps": [
          {
            "order": 1,
            "evidence_ir": "IR-001",
            "action": "Attacker connects to a libssh-based server, completes the SSH transport handshake (KEXINIT, key exchange, NEWKEYS).",
            "result": "Session reaches the user-auth phase; session->session_state is SSH_SESSION_STATE_AUTHENTICATING and the dispatcher is willing to deliver user-auth-layer messages."
          },
          {
            "order": 2,
            "evidence_ir": "IR-001",
            "action": "Attacker sends a single packet with type = 52 (SSH2_MSG_USERAUTH_SUCCESS), which is normally a server-to-client message.",
            "result": "ssh_packet_socket_callback (src/packet.c:144) reads the bytes, ssh_packet_parse_type (src/packet.c:531) stores 52 into session->in_packet.type, and ssh_packet_process (src/packet.c:440) dispatches default_packet_handlers[52] = ssh_packet_userauth_success."
          },
          {
            "order": 3,
            "evidence_ir": "IR-001",
            "action": "ssh_packet_userauth_success (src/auth.c:277) executes its body unconditionally — there is no role check (server vs. client) and no session-state precondition.",
            "result": "At src/auth.c:285-287 the session is marked authenticated: auth.state = SSH_AUTH_STATE_SUCCESS, session_state = SSH_SESSION_STATE_AUTHENTICATED, flags |= SSH_SESSION_FLAG_AUTHENTICATED."
          },
          {
            "order": 4,
            "evidence_ir": "IR-002",
            "action": "On the same SSH connection (state still flipped post-IR-001), the attacker sends a SSH2_MSG_CHANNEL_OPEN packet (type=90). ssh_packet_socket_callback (src/packet.c:144) → ssh_packet_process (src/packet.c:440) walks the same default_packet_handlers static table and routes type=90 to ssh_packet_channel_open at src/messages.c:1059.",
            "result": "Control reaches ssh_packet_channel_open with the per-session authentication state still corrupted — session->session_state == SSH_SESSION_STATE_AUTHENTICATED."
          },
          {
            "order": 5,
            "evidence_ir": "IR-002",
            "action": "ssh_packet_channel_open parses the channel type string and sender / window / packet_size fields (src/messages.c:1074, 1082-1085), then reaches the post-auth gate at src/messages.c:1087: 'if (session->session_state != SSH_SESSION_STATE_AUTHENTICATED) goto error'. Because IR-001 wrote SSH_SESSION_STATE_AUTHENTICATED into the same per-session field with no revalidation step between IR-001's write and IR-002's read, the gate fails open. The function then commits to building a channel_request_open message (lines 1092-1148) and hands it to the libssh application layer.",
            "result": "Channel-open request is accepted as if from an authenticated client. The libssh-using application receives a channel-open message believing the requesting party is authenticated."
          },
          {
            "order": 6,
            "evidence_ir": "IR-002",
            "action": "The same write → read-without-revalidation pattern repeats at every other site that consumes the corrupted per-session state: src/server.c:524 (server state machine promotes to AUTHENTICATED), src/wrapper.c:506 / :521 (delayed compression activation), src/kex.c:443 (re-key permission). Each is documented in IR-002.evidence_anchors as a symmetric read site.",
            "result": "Beyond channel-open, the attacker is also granted: re-key control, compression / MAC initialisation, and the wider post-auth state machine — all gated on the same per-session field that IR-001 wrote without credential validation."
          }
        ]
      },
      "sink": {
        "function": "ssh_packet_userauth_success",
        "file": "src/auth.c",
        "line": 286,
        "evidence_ir_id": "IR-001",
        "sink_type": "auth_bypass"
      },
      "impact": {
        "category": "privilege_bypass",
        "description": "Full authentication bypass on libssh-based SSH servers (libssh 0.6.0..0.7.5 and 0.8.0). Attacker reaches the server-application layer with session marked as authenticated without ever proving any credential. The server-side application built on libssh decides what 'authenticated' permits — the libssh primitive itself is broken."
      },
      "verdict": {
        "exploitability": "high",
        "reason": "Single-packet attack from any TCP client that reaches the server. No special crypto, no race, no parser quirks. PoCs exist publicly (e.g. the original disclosure; libssh test e1548a71 implements the test harness in tests/server). The fix is a defense-in-depth filter, indicating the original gap is structural, not corner-case."
      },
      "confidence": "high",
      "uncertainty": "Real-world impact varies by what the server-application authorizes for an authenticated session: shell access, port-forwarding, file transfer, etc. None of that is enforced at libssh's layer — the bypass hands the application a session it believes is authenticated."
    }
  ]
}
